{
  "schemaVersion": "1.0",
  "contentVersion": "1.1.0",
  "id": "gospel-songs",
  "name": "gospel-songs",
  "title": "Gospel Songs",
  "subtitle": "Public-domain starter collection",
  "language": "English",
  "cover": {
    "image": "assets/Rongmei Gospel song books.png",
    "alt": "Rongmei Hymnal library artwork"
  },
  "theme": {
    "accent": "#365c84",
    "accentSoft": "#bfd6e9"
  },
  "intro": {
    "summary": "A small public-domain collection included to demonstrate a second, independent songbook.",
    "description": "This example shows how a book can carry its own cover, credits, editorial notes, and song source."
  },
  "credits": {
    "editor": "Rongmei Hymnal Editorial Team",
    "compiledBy": "Public-domain starter collection",
    "publisher": "Rongmei Hymnal",
    "year": "2026",
    "rights": "Included texts are identified as public domain; verify the rights for every additional song before publishing."
  },
  "changelog": [
    {
      "date": "2026-08-31",
      "note": "Sample songs now use structured verses for clearer reading and presentation mode."
    }
  ],
  "songs": {
    "file": "songs.json",
    "url": "",
    "count": 2,
    "updatedAt": "2026-08-31"
  }
}
